ID,STIX ID,name,description,url,created,last modified,domain,version,associated campaigns,associated campaigns citations,first seen,first seen citation,last seen,last seen citation,contributors,relationship citations
C0028,campaign--46421788-b6e1-4256-b351-f8beffd1afba,2015 Ukraine Electric Power Attack,[2015 Ukraine Electric Power Attack](https://attack.mitre.org/campaigns/C0028) was a [Sandworm Team](https://attack.mitre.org/groups/G0034) campaign during which they used [BlackEnergy](https://attack.mitre.org/software/S0089) (specifically BlackEnergy3) and [KillDisk](https://attack.mitre.org/software/S0607) to target and disrupt transmission and distribution substations within the Ukrainian power grid. This campaign was the first major public attack conducted against the Ukrainian power grid by Sandworm Team.,https://attack.mitre.org/campaigns/C0028,27 September 2023,06 October 2023,"ics-attack,enterprise-attack",1.0,,,01 December 2015,(Citation: Booz Allen Hamilton),01 January 2016,(Citation: Booz Allen Hamilton),,"(Citation: Booz Allen Hamilton),(Citation: Charles McLellan March 2016),(Citation: Ukraine15 - EISAC - 201603),(Citation: Booz Allen Hamilton),(Citation: US District Court Indictment GRU Unit 74455 October 2020),(Citation: Andy Greenberg June 2017)"
C0025,campaign--aa73efef-1418-4dbe-b43c-87a498e97234,2016 Ukraine Electric Power Attack,[2016 Ukraine Electric Power Attack](https://attack.mitre.org/campaigns/C0025) was a [Sandworm Team](https://attack.mitre.org/groups/G0034) campaign during which they used [Industroyer](https://attack.mitre.org/software/S0604) malware to target and disrupt distribution substations within the Ukrainian power grid. This campaign was the second major public attack conducted against Ukraine by [Sandworm Team](https://attack.mitre.org/groups/G0034).(Citation: ESET Industroyer)(Citation: Dragos Crashoverride 2018),https://attack.mitre.org/campaigns/C0025,31 March 2023,10 April 2023,"enterprise-attack,ics-attack",1.0,,,01 December 2016,(Citation: ESET Industroyer)(Citation: Dragos Crashoverride 2018),01 December 2016,(Citation: ESET Industroyer)(Citation: Dragos Crashoverride 2018),,"(Citation: Dragos Crashoverride 2018),(Citation: ESET Industroyer),(Citation: Dragos Crashoverride 2018),(Citation: Dragos Crashoverride 2017),(Citation: ESET Industroyer),(Citation: US District Court Indictment GRU Unit 74455 October 2020),(Citation: Joe Slowik August 2019)"
C0010,campaign--ab747e62-1bcb-479f-a26b-1cd39d413d81,C0010,"[C0010](https://attack.mitre.org/campaigns/C0010) was a cyber espionage campaign conducted by UNC3890 that targeted Israeli shipping, government, aviation, energy, and healthcare organizations. Security researcher assess UNC3890 conducts operations in support of Iranian interests, and noted several limited technical connections to Iran, including PDB strings and Farsi language artifacts. [C0010](https://attack.mitre.org/campaigns/C0010) began by at least late 2020, and was still ongoing as of mid-2022.(Citation: Mandiant UNC3890 Aug 2022)",https://attack.mitre.org/campaigns/C0010,21 September 2022,04 October 2022,enterprise-attack,1.0,,,01 December 2020,(Citation: Mandiant UNC3890 Aug 2022),01 August 2022,(Citation: Mandiant UNC3890 Aug 2022),,"(Citation: Mandiant UNC3890 Aug 2022),(Citation: Mandiant UNC3890 Aug 2022),"
C0011,campaign--b4e5a4a9-f3be-4631-ba8f-da6ebb067fac,C0011,"[C0011](https://attack.mitre.org/campaigns/C0011) was a suspected cyber espionage campaign conducted by [Transparent Tribe](https://attack.mitre.org/groups/G0134) that targeted students at universities and colleges in India. Security researchers noted this campaign against students was a significant shift from [Transparent Tribe](https://attack.mitre.org/groups/G0134)'s historic targeting Indian government, military, and think tank personnel, and assessed it was still ongoing as of July 2022.(Citation: Cisco Talos Transparent Tribe Education Campaign July 2022) ",https://attack.mitre.org/campaigns/C0011,22 September 2022,22 September 2022,enterprise-attack,1.0,,,01 December 2021,(Citation: Cisco Talos Transparent Tribe Education Campaign July 2022),01 July 2022,(Citation: Cisco Talos Transparent Tribe Education Campaign July 2022),,"(Citation: Cisco Talos Transparent Tribe Education Campaign July 2022),(Citation: Cisco Talos Transparent Tribe Education Campaign July 2022),(Citation: Cisco Talos Transparent Tribe Education Campaign July 2022)"
C0015,campaign--78068e68-4124-4243-b6f4-76e4e5be8a06,C0015,"[C0015](https://attack.mitre.org/campaigns/C0015) was a ransomware intrusion during which the unidentified attackers used [Bazar](https://attack.mitre.org/software/S0534), [Cobalt Strike](https://attack.mitre.org/software/S0154), and [Conti](https://attack.mitre.org/software/S0575), along with other tools, over a 5 day period. Security researchers assessed the actors likely used the widely-circulated [Conti](https://attack.mitre.org/software/S0575) ransomware playbook based on the observed pattern of activity and operator errors.(Citation: DFIR Conti Bazar Nov 2021)",https://attack.mitre.org/campaigns/C0015,29 September 2022,29 September 2022,enterprise-attack,1.0,,,01 August 2021,(Citation: DFIR Conti Bazar Nov 2021),01 August 2021,(Citation: DFIR Conti Bazar Nov 2021),"Matt Brenton, Zurich Insurance Group","(Citation: DFIR Conti Bazar Nov 2021),(Citation: DFIR Conti Bazar Nov 2021),"
C0017,campaign--ba6dfa37-f401-4140-88b0-8938f2895e61,C0017,"[C0017](https://attack.mitre.org/campaigns/C0017) was an [APT41](https://attack.mitre.org/groups/G0096) campaign conducted between May 2021 and February 2022 that successfully compromised at least six U.S. state government networks through the exploitation of vulnerable Internet facing web applications. During [C0017](https://attack.mitre.org/campaigns/C0017), [APT41](https://attack.mitre.org/groups/G0096) was quick to adapt and use publicly-disclosed as well as zero-day vulnerabilities for initial access, and in at least two cases re-compromised victims following remediation efforts. The goals of [C0017](https://attack.mitre.org/campaigns/C0017) are unknown, however [APT41](https://attack.mitre.org/groups/G0096) was observed exfiltrating Personal Identifiable Information (PII).(Citation: Mandiant APT41)",https://attack.mitre.org/campaigns/C0017,01 December 2022,25 January 2023,enterprise-attack,1.0,,,01 May 2021,(Citation: Mandiant APT41),01 February 2022,(Citation: Mandiant APT41),"Kyaw Pyiyt Htet, @KyawPyiytHtet","(Citation: Mandiant APT41),(Citation: Mandiant APT41),(Citation: Mandiant APT41)"
C0018,campaign--519ee082-8ab6-439b-988f-a8a3f02c8d30,C0018,"
[C0018](https://attack.mitre.org/campaigns/C0018) was a month-long ransomware intrusion that successfully deployed [AvosLocker](https://attack.mitre.org/software/S1053) onto a compromised network. The unidentified actors gained initial access to the victim network through an exposed server and used a variety of open-source tools prior to executing [AvosLocker](https://attack.mitre.org/software/S1053).(Citation: Costa AvosLocker May 2022)(Citation: Cisco Talos Avos Jun 2022)",https://attack.mitre.org/campaigns/C0018,17 January 2023,14 February 2023,enterprise-attack,1.0,,,01 February 2022,(Citation: Cisco Talos Avos Jun 2022),01 March 2022,(Citation: Cisco Talos Avos Jun 2022),"Flavio Costa, Cisco","(Citation: Cisco Talos Avos Jun 2022),(Citation: Costa AvosLocker May 2022),(Citation: Cisco Talos Avos Jun 2022),(Citation: Costa AvosLocker May 2022),"
C0021,campaign--712e38c3-a656-426a-9b3b-a6bfb63294c6,C0021,"[C0021](https://attack.mitre.org/campaigns/C0021) was a spearphishing campaign conducted in November 2018 that targeted public sector institutions, non-governmental organizations (NGOs), educational institutions, and private-sector corporations in the oil and gas, chemical, and hospitality industries. The majority of targets were located in the US, particularly in and around Washington D.C., with other targets located in Europe, Hong Kong, India, and Canada. [C0021](https://attack.mitre.org/campaigns/C0021)'s technical artifacts, tactics, techniques, and procedures (TTPs), and targeting overlap with previous suspected [APT29](https://attack.mitre.org/groups/G0016) activity.(Citation: Microsoft Unidentified Dec 2018)(Citation: FireEye APT29 Nov 2018)",https://attack.mitre.org/campaigns/C0021,15 March 2023,05 April 2023,enterprise-attack,1.0,,,01 November 2018,(Citation: FireEye APT29 Nov 2018)(Citation: Microsoft Unidentified Dec 2018),01 November 2018,(Citation: FireEye APT29 Nov 2018)(Citation: Microsoft Unidentified Dec 2018),,"(Citation: Microsoft Unidentified Dec 2018),(Citation: FireEye APT29 Nov 2018),(Citation: Microsoft Unidentified Dec 2018),(Citation: FireEye APT29 Nov 2018),"
C0026,campaign--c89fa3ff-4773-4daf-8aec-d8f43f10116e,C0026,[C0026](https://attack.mitre.org/campaigns/C0026) was a campaign identified in September 2022 that included the selective distribution of [KOPILUWAK](https://attack.mitre.org/software/S1075) and [QUIETCANARY](https://attack.mitre.org/software/S1076) malware to previous [ANDROMEDA](https://attack.mitre.org/software/S1074) malware victims in Ukraine through re-registered [ANDROMEDA](https://attack.mitre.org/software/S1074) C2 domains. Several tools and tactics used during [C0026](https://attack.mitre.org/campaigns/C0026) were consistent with historic [Turla](https://attack.mitre.org/groups/G0010) operations.(Citation: Mandiant Suspected Turla Campaign February 2023),https://attack.mitre.org/campaigns/C0026,15 May 2023,29 September 2023,enterprise-attack,1.0,,,01 August 2022,(Citation: Mandiant Suspected Turla Campaign February 2023),01 September 2022,(Citation: Mandiant Suspected Turla Campaign February 2023),"Manikantan Srinivasan, NEC Corporation India; Pooja Natarajan, NEC Corporation India; Yoshihiro Kori, NEC Corporation","(Citation: Mandiant Suspected Turla Campaign February 2023),(Citation: Mandiant Suspected Turla Campaign February 2023),"
C0027,campaign--df74f7ad-b10d-431c-9f1d-a2bc18dadefa,C0027,"[C0027](https://attack.mitre.org/campaigns/C0027) was a financially-motivated campaign linked to [Scattered Spider](https://attack.mitre.org/groups/G1015) that targeted telecommunications and business process outsourcing (BPO) companies from at least June through December of 2022. During [C0027](https://attack.mitre.org/campaigns/C0027) [Scattered Spider](https://attack.mitre.org/groups/G1015) used various forms of social engineering, performed SIM swapping, and attempted to leverage access from victim environments to mobile carrier networks.(Citation: Crowdstrike TELCO BPO Campaign December 2022)
",https://attack.mitre.org/campaigns/C0027,30 June 2023,05 July 2023,enterprise-attack,1.0,,,01 June 2022,(Citation: Crowdstrike TELCO BPO Campaign December 2022),01 December 2022,(Citation: Crowdstrike TELCO BPO Campaign December 2022),,"(Citation: Crowdstrike TELCO BPO Campaign December 2022),(Citation: Crowdstrike TELCO BPO Campaign December 2022),(Citation: Crowdstrike TELCO BPO Campaign December 2022)"
C0004,campaign--f9cc545e-b0ef-4b92-8884-a3a4427609f6,CostaRicto,"[CostaRicto](https://attack.mitre.org/campaigns/C0004) was a suspected hacker-for-hire cyber espionage campaign that targeted multiple industries worldwide, with a large number being financial institutions. [CostaRicto](https://attack.mitre.org/campaigns/C0004) actors targeted organizations in Europe, the Americas, Asia, Australia, and Africa, with a large concentration in South Asia (especially India, Bangladesh, and Singapore), using custom malware, open source tools, and a complex network of proxies and SSH tunnels.(Citation: BlackBerry CostaRicto November 2020)",https://attack.mitre.org/campaigns/C0004,15 September 2022,05 October 2022,enterprise-attack,1.0,,,01 October 2019,(Citation: BlackBerry CostaRicto November 2020),01 November 2020,(Citation: BlackBerry CostaRicto November 2020),,"(Citation: BlackBerry CostaRicto November 2020),(Citation: BlackBerry CostaRicto November 2020),"
C0001,campaign--26d9ebae-de59-427f-ae9a-349456bae4b1,Frankenstein,"[Frankenstein](https://attack.mitre.org/campaigns/C0001) was described by security researchers as a highly-targeted campaign conducted by moderately sophisticated and highly resourceful threat actors in early 2019. The unidentified actors primarily relied on open source tools, including [Empire](https://attack.mitre.org/software/S0363). The campaign name refers to the actors' ability to piece together several unrelated open-source tool components.(Citation: Talos Frankenstein June 2019)",https://attack.mitre.org/campaigns/C0001,07 September 2022,22 March 2023,enterprise-attack,1.1,,,01 January 2019,(Citation: Talos Frankenstein June 2019),01 April 2019,(Citation: Talos Frankenstein June 2019),,"(Citation: Talos Frankenstein June 2019),(Citation: Talos Frankenstein June 2019),"
C0007,campaign--8d2bc130-89fe-466e-a4f9-6bce6129c2b8,FunnyDream,"[FunnyDream](https://attack.mitre.org/campaigns/C0007) was a suspected Chinese cyber espionage campaign that targeted government and foreign organizations in Malaysia, the Philippines, Taiwan, Vietnam, and other parts of Southeast Asia. Security researchers linked the [FunnyDream](https://attack.mitre.org/campaigns/C0007) campaign to possible Chinese-speaking threat actors through the use of the [Chinoxy](https://attack.mitre.org/software/S1041) backdoor and noted infrastructure overlap with the TAG-16 threat group.(Citation: Bitdefender FunnyDream Campaign November 2020)(Citation: Kaspersky APT Trends Q1 2020)(Citation: Recorded Future Chinese Activity in Southeast Asia December 2021)",https://attack.mitre.org/campaigns/C0007,20 September 2022,10 October 2022,enterprise-attack,1.0,,,01 July 2018,(Citation: Kaspersky APT Trends Q1 2020),01 November 2020,(Citation: Bitdefender FunnyDream Campaign November 2020),,"(Citation: Bitdefender FunnyDream Campaign November 2020),(Citation: Bitdefender FunnyDream Campaign November 2020),"
C0002,campaign--ae407e32-87e0-4d92-8705-3ae25d504d8a,Night Dragon,"[Night Dragon](https://attack.mitre.org/campaigns/C0002) was a cyber espionage campaign that targeted oil, energy, and petrochemical companies, along with individuals and executives in Kazakhstan, Taiwan, Greece, and the United States. The unidentified threat actors searched for information related to oil and gas field production systems, financials, and collected data from SCADA systems. Based on the observed techniques, tools, and network activities, security researchers assessed the campaign involved a threat group based in China.(Citation: McAfee Night Dragon)",https://attack.mitre.org/campaigns/C0002,08 September 2022,22 September 2022,enterprise-attack,1.0,,,01 November 2009,(Citation: McAfee Night Dragon),01 February 2011,(Citation: McAfee Night Dragon),,"(Citation: McAfee Night Dragon),(Citation: McAfee Night Dragon),"
C0012,campaign--93c23946-49af-41f4-ac03-40f9ffc7419b,Operation CuckooBees,"[Operation CuckooBees](https://attack.mitre.org/campaigns/C0012) was a cyber espionage campaign targeting technology and manufacturing companies in East Asia, Western Europe, and North America since at least 2019. Security researchers noted the goal of [Operation CuckooBees](https://attack.mitre.org/campaigns/C0012), which was still ongoing as of May 2022, was likely the theft of proprietary information, research and development documents, source code, and blueprints for various technologies. Researchers assessed [Operation CuckooBees](https://attack.mitre.org/campaigns/C0012) was conducted by actors affiliated with [Winnti Group](https://attack.mitre.org/groups/G0044), [APT41](https://attack.mitre.org/groups/G0096), and BARIUM.(Citation: Cybereason OperationCuckooBees May 2022)",https://attack.mitre.org/campaigns/C0012,22 September 2022,22 March 2023,enterprise-attack,1.1,,,01 December 2019,(Citation: Cybereason OperationCuckooBees May 2022),01 May 2022,(Citation: Cybereason OperationCuckooBees May 2022),"Andrea Serrano Urea, Telefónica Tech","(Citation: Cybereason OperationCuckooBees May 2022),(Citation: Cybereason OperationCuckooBees May 2022),"
C0022,campaign--0257b35b-93ef-4a70-80dd-ad5258e6045b,Operation Dream Job,"[Operation Dream Job](https://attack.mitre.org/campaigns/C0022) was a cyber espionage operation likely conducted by [Lazarus Group](https://attack.mitre.org/groups/G0032) that targeted the defense, aerospace, government, and other sectors in the United States, Israel, Australia, Russia, and India. In at least one case, the cyber actors tried to monetize their network access to conduct a business email compromise (BEC) operation. In 2020, security researchers noted overlapping TTPs, to include fake job lures and code similarities, between [Operation Dream Job](https://attack.mitre.org/campaigns/C0022), Operation North Star, and Operation Interception; by 2022 security researchers described [Operation Dream Job](https://attack.mitre.org/campaigns/C0022) as an umbrella term covering both Operation Interception and Operation North Star.(Citation: ClearSky Lazarus Aug 2020)(Citation: McAfee Lazarus Jul 2020)(Citation: ESET Lazarus Jun 2020)(Citation: The Hacker News Lazarus Aug 2022)",https://attack.mitre.org/campaigns/C0022,17 March 2023,27 September 2023,enterprise-attack,1.1,"Operation Interception, Operation North Star","(Citation: ESET Lazarus Jun 2020), (Citation: McAfee Lazarus Jul 2020)(Citation: McAfee Lazarus Nov 2020)",01 September 2019,(Citation: ESET Lazarus Jun 2020),01 August 2020,(Citation: ClearSky Lazarus Aug 2020),,"(Citation: ClearSky Lazarus Aug 2020),(Citation: McAfee Lazarus Nov 2020),(Citation: McAfee Lazarus Jul 2020),(Citation: McAfee Lazarus Jul 2020),(Citation: The Hacker News Lazarus Aug 2022),(Citation: ESET Lazarus Jun 2020),(Citation: McAfee Lazarus Nov 2020),(Citation: ClearSky Lazarus Aug 2020),(Citation: ESET Lazarus Jun 2020),(Citation: ClearSky Lazarus Aug 2020),(Citation: McAfee Lazarus Nov 2020),(Citation: McAfee Lazarus Jul 2020)"
C0016,campaign--4603cf2f-06d0-4970-9c5d-5071b08c817f,Operation Dust Storm,"[Operation Dust Storm](https://attack.mitre.org/campaigns/C0016) was a long-standing persistent cyber espionage campaign that targeted multiple industries in Japan, South Korea, the United States, Europe, and several Southeast Asian countries. By 2015, the [Operation Dust Storm](https://attack.mitre.org/campaigns/C0016) threat actors shifted from government and defense-related intelligence targets to Japanese companies or Japanese subdivisions of larger foreign organizations supporting Japan's critical infrastructure, including electricity generation, oil and natural gas, finance, transportation, and construction.(Citation: Cylance Dust Storm)

[Operation Dust Storm](https://attack.mitre.org/campaigns/C0016) threat actors also began to use Android backdoors in their operations by 2015, with all identified victims at the time residing in Japan or South Korea.(Citation: Cylance Dust Storm)",https://attack.mitre.org/campaigns/C0016,29 September 2022,30 September 2022,"enterprise-attack,mobile-attack",1.0,,,01 January 2010,(Citation: Cylance Dust Storm),01 February 2016,(Citation: Cylance Dust Storm),,"(Citation: Cylance Dust Storm),(Citation: Cylance Dust Storm),"
C0023,campaign--7854c1a0-f06c-4876-98a4-4bbd34751b05,Operation Ghost,"[Operation Ghost](https://attack.mitre.org/campaigns/C0023) was an [APT29](https://attack.mitre.org/groups/G0016) campaign starting in 2013 that included operations against ministries of foreign affairs in Europe and the Washington, D.C. embassy of a European Union country. During [Operation Ghost](https://attack.mitre.org/campaigns/C0023), [APT29](https://attack.mitre.org/groups/G0016) used new families of malware and leveraged web services, steganography, and unique C2 infrastructure for each victim.(Citation: ESET Dukes October 2019)
",https://attack.mitre.org/campaigns/C0023,23 March 2023,06 April 2023,enterprise-attack,1.0,,,01 September 2013,(Citation: ESET Dukes October 2019),01 October 2019,(Citation: ESET Dukes October 2019),,"(Citation: ESET Dukes October 2019),(Citation: ESET Dukes October 2019),(Citation: ESET Dukes October 2019)"
C0006,campaign--4553292d-12c6-4a93-934d-12160370d4e0,Operation Honeybee,"[Operation Honeybee](https://attack.mitre.org/campaigns/C0006) was a campaign that targeted humanitarian aid and inter-Korean affairs organizations from at least late 2017 through early 2018. [Operation Honeybee](https://attack.mitre.org/campaigns/C0006) initially targeted South Korea, but expanded to include Vietnam, Singapore, Japan, Indonesia, Argentina, and Canada. Security researchers assessed the threat actors were likely Korean speakers based on metadata used in both lure documents and executables, and named the campaign ""Honeybee"" after the author name discovered in malicious Word documents.(Citation: McAfee Honeybee) ",https://attack.mitre.org/campaigns/C0006,16 September 2022,13 October 2022,enterprise-attack,1.0,,,01 August 2017,(Citation: McAfee Honeybee),01 February 2018,(Citation: McAfee Honeybee),,"(Citation: McAfee Honeybee),(Citation: McAfee Honeybee),"
C0013,campaign--37764c78-2a99-46d1-a7ea-6454b9bf93a0,Operation Sharpshooter,"[Operation Sharpshooter](https://attack.mitre.org/campaigns/C0013) was a global cyber espionage campaign that targeted nuclear, defense, government, energy, and financial companies, with many located in Germany, Turkey, the United Kingdom, and the United States. Security researchers noted the campaign shared many similarities with previous [Lazarus Group](https://attack.mitre.org/groups/G0032) operations, including fake job recruitment lures and shared malware code.(Citation: McAfee Sharpshooter December 2018)(Citation: Bleeping Computer Op Sharpshooter March 2019)(Citation: Threatpost New Op Sharpshooter Data March 2019)    ",https://attack.mitre.org/campaigns/C0013,26 September 2022,13 October 2022,enterprise-attack,1.0,,,01 September 2017,(Citation: Threatpost New Op Sharpshooter Data March 2019),01 March 2019,(Citation: Threatpost New Op Sharpshooter Data March 2019),,"(Citation: Bleeping Computer Op Sharpshooter March 2019),(Citation: McAfee Sharpshooter December 2018),(Citation: Bleeping Computer Op Sharpshooter March 2019),(Citation: McAfee Sharpshooter December 2018),(Citation: Threatpost New Op Sharpshooter Data March 2019),"
C0005,campaign--4c840263-bbda-440d-a22b-674679ddebf1,Operation Spalax,"[Operation Spalax](https://attack.mitre.org/campaigns/C0005) was a campaign that primarily targeted Colombian government organizations and private companies, particularly those associated with the energy and metallurgical industries. The [Operation Spalax](https://attack.mitre.org/campaigns/C0005) threat actors distributed commodity malware and tools using generic phishing topics related to COVID-19, banking, and law enforcement action. Security researchers noted indicators of compromise and some infrastructure overlaps with other campaigns dating back to April 2018, including at least one separately attributed to [APT-C-36](https://attack.mitre.org/groups/G0099), however identified enough differences to report this as separate, unattributed activity.(Citation: ESET Operation Spalax Jan 2021)  ",https://attack.mitre.org/campaigns/C0005,16 September 2022,13 October 2022,enterprise-attack,1.0,,,01 November 2019,(Citation: ESET Operation Spalax Jan 2021),01 January 2021,(Citation: ESET Operation Spalax Jan 2021),,"(Citation: ESET Operation Spalax Jan 2021),(Citation: ESET Operation Spalax Jan 2021),"
C0014,campaign--b03d5112-e23a-4ac8-add0-be7502d24eff,Operation Wocao,"[Operation Wocao](https://attack.mitre.org/campaigns/C0014) was a cyber espionage campaign that targeted organizations around the world, including in Brazil, China, France, Germany, Italy, Mexico, Portugal, Spain, the United Kingdom, and the United States. The suspected China-based actors compromised government organizations and managed service providers, as well as aviation, construction, energy, finance, health care, insurance, offshore engineering, software development, and transportation companies.(Citation: FoxIT Wocao December 2019)

Security researchers assessed the [Operation Wocao](https://attack.mitre.org/campaigns/C0014) actors used similar TTPs and tools as APT20, suggesting a possible overlap. [Operation Wocao](https://attack.mitre.org/campaigns/C0014) was named after an observed command line entry by one of the threat actors, possibly out of frustration from losing webshell access.(Citation: FoxIT Wocao December 2019)",https://attack.mitre.org/campaigns/C0014,27 September 2022,22 March 2023,enterprise-attack,1.1,,,01 December 2017,(Citation: FoxIT Wocao December 2019),01 December 2019,(Citation: FoxIT Wocao December 2019),"Erik Schamper, @Schamperr, Fox-IT; Maarten van Dantzig, @MaartenVDantzig, Fox-IT","(Citation: FoxIT Wocao December 2019),(Citation: FoxIT Wocao December 2019),"
